{
  "journey_id": "idea-to-production",
  "version": "0.4.1",
  "status": "canonical",
  "objective": "Take a person from a rough idea or partial implementation to a real accepted deliverable on the target its intended consumer actually uses, through evidence-driven AAOP route transitions without making the user operate the engineering machinery.",
  "routing_policy": {
    "intake_selects_current_route": true,
    "greenfield_gates_are_conditional": true,
    "reroute_requires_new_evidence": true,
    "stale_checkpoint_never_overrides_current_evidence": true,
    "completed_cycle_must_reopen_explicitly": true,
    "autonomous_takeover_reconstructs_intent_and_selects_current_goal": true,
    "route_completion_is_not_project_completion": true,
    "blocked_delta_is_scoped_and_frontier_recomputed": true,
    "bounded_execution_end_is_handoff_not_completion": true,
    "project_frontier_reconciled_before_project_pause": true,
    "deliverable_target_recovered_before_completion": true
  },
  "completion_policy": {
    "blocked_is_complete": false,
    "target_verification_required": true,
    "target_verification_is_cycle_scoped": true,
    "local_or_ci_evidence_cannot_substitute_for_target_evidence": true,
    "single_blocker_cannot_block_project_when_other_executable_delta_exists": true,
    "project_pause_requires_no_meaningful_authorized_executable_frontier_or_bounded_run_end": true,
    "local_no_mutation_is_not_project_no_frontier": true,
    "green_checks_are_not_project_completion": true,
    "green_aggregate_requires_trustworthy_verification_harness": true,
    "completion_contract_is_deliverable_target_aware": true
  },
  "state_contract": {
    "runtime_file": ".aaop/runtime/journeys/idea-to-production.json",
    "schema": ".aaop/schemas/journey-state.schema.json",
    "checkpoint_tool": ".aaop/tools/journey.py",
    "write_precondition": "Every checkpoint mutation must use the revision returned by the latest reconciled status read; stale revisions are rejected while mutation is serialized by a local OS file lock.",
    "authority": "Journey state is a resumability checkpoint only. Current repository, runtime, target/consumer environment, user, and materially current project-work evidence wins when it conflicts with a saved checkpoint. Completed release evidence is historical and must not satisfy a later release cycle."
  },
  "entry_conditions": [
    "the user has a project/product idea or an existing partial implementation",
    "the desired outcome spans more than one route transition",
    "the user wants the system to continue through implementation and real target acceptance rather than only provide advice"
  ],
  "user_owns": [
    "product intent and domain truth",
    "material product decisions that cannot be inferred from evidence",
    "credentials and external-account authorization when required",
    "consequential production/publication/install authorization unless an existing explicit policy already grants it",
    "material legal/rights decisions whose intended grant cannot be inferred from current project authority"
  ],
  "system_owns": [
    "route selection and rerouting",
    "intent reconstruction and current-goal selection from current project evidence",
    "recovery of the actual deliverable, intended consumer, and observable target before project-completion claims",
    "bounded reconciliation of materially current project work topology and unmet acceptance evidence before project pause/no-frontier claims",
    "technical discovery and stack decisions derived from constraints",
    "task decomposition and sequencing",
    "implementation and verification",
    "verification-harness integrity and evidence-target fidelity when a custom aggregator materially determines acceptance, regression, completion, or release evidence",
    "scoped blocker handling and executable-frontier recomputation after every completed, blocked, or no-op delta",
    "containment of dependent verification debt while continuing genuinely independent authorized frontier",
    "journey checkpoint maintenance, resume reconciliation, and stale-write prevention",
    "release-cycle boundaries so old target verification cannot prove a later release",
    "capability/provider selection only after a proven gap",
    "release/delivery preflight preparation and rollback, uninstall, restore, or other target-appropriate reversal planning"
  ],
  "gates": [
    {
      "id": "intake",
      "route_selection": "developer-intake",
      "goal": "Resolve the current situation, reconstruct the long-horizon observable outcome when a novice delegates takeover, recover the actual deliverable/consumer/target shape when it can change completion, reconcile any materially current project-declared work topology that can change the goal, choose the current highest-value evidence-backed result, and identify the next evidence-bearing step without assuming the project is greenfield, application-shaped, or that the checked-out branch is the whole project frontier.",
      "exit_evidence": [
        "provisional observable outcome",
        "provisional deliverable/consumer/target contract when material to completion",
        "current primary route selected from present evidence",
        "material current work target/candidate/predecessor-successor evidence when it can change the goal",
        "solution vocabulary classification when relevant",
        "first material uncertainty or immediate blocker"
      ]
    },
    {
      "id": "first-slice",
      "primary_route": "idea-to-build",
      "applies_when": "No trustworthy existing consumer-observable slice already provides enough evidence to continue from the current implementation.",
      "skip_when": "A trustworthy existing implementation already has a usable consumer-observable slice and the immediate problem belongs to another route.",
      "goal": "Define and build the smallest real slice that buys useful learning for the intended consumer without prematurely choosing a deployment shape.",
      "exit_evidence": [
        "acceptance path",
        "explicit non-goals",
        "working artifact or observable behavior",
        "evidence that at least one material uncertainty was reduced"
      ]
    },
    {
      "id": "project-readiness",
      "route_selection": "current-route",
      "possible_reroutes": ["repo-recovery"],
      "goal": "Establish only the minimum trustworthy project/environment/artifact baseline and current project frontier required to continue from the current state.",
      "exit_evidence": [
        "trusted project baseline",
        "known validation commands or equivalent evidence",
        "verification-harness integrity and evidence-target-fidelity status when a custom aggregator materially determines acceptance",
        "material current work topology/acceptance gaps when they affect the next goal",
        "known blockers and verification debt",
        "saved Journey checkpoint reconciled with current evidence"
      ]
    },
    {
      "id": "implementation-loop",
      "route_selection": "current-route",
      "applies_when": "A verified implementation, validation, review, candidate-convergence, packaging, consumer-target, or other accepted-outcome delta remains after intake/project discovery, whether that delta is on the current checkout or another project-declared current work target.",
      "possible_reroutes": ["bug-fix", "feature-change", "repo-recovery", "understand-review"],
      "goal": "Iterate through the smallest coherent evidence-backed changes under the current Route, recomputing the highest-value safe executable project frontier after every verified, blocked, or no-op delta. Green checks or no-local-mutation prove only their tested/scope claims, and a custom aggregate is not strong acceptance evidence until the material harness discovery/identity/failure-propagation/evidence-target path is trustworthy. A human or external boundary blocks only the affected scope; continue genuinely independent authorized work on the correct current work target while containing dependent verification debt until intended deliverable behavior is present or project-frontier reconciliation finds no meaningful executable frontier.",
      "exit_evidence": [
        "acceptance behavior",
        "regression evidence",
        "reviewed diff or scope-level no-mutation evidence",
        "current next-decision evidence",
        "current work target/frontier evidence when the checkout is not the whole active project surface",
        "scoped blocker plus recomputed remaining frontier when any delta is blocked",
        "material verification debt explicitly unknown until retired by the required evidence"
      ]
    },
    {
      "id": "release-candidate",
      "route_selection": "current-route",
      "possible_reroutes": ["bug-fix", "feature-change", "repo-recovery"],
      "goal": "Prove that the current deliverable is a release/delivery candidate for its real consumer target, not merely locally complete, and respect project-declared candidate/predecessor/successor ordering when that ordering is current authority.",
      "exit_evidence": [
        "relevant tests/build checks",
        "known CI or approved executable-gate state",
        "verification-harness integrity and evidence-target-fidelity status when a custom aggregate materially contributes to release eligibility",
        "current candidate/base/head/order evidence when material",
        "final artifact/install/distribution closure evidence when the deliverable crosses an artifact boundary",
        "configuration requirements",
        "secret/sensitive-data review",
        "migration impact when applicable",
        "rollback/uninstall/restore prerequisites appropriate to the actual target",
        "outbound rights status when third-party reuse/redistribution is part of the accepted outcome"
      ]
    },
    {
      "id": "release-preflight",